id,text
item_1,"Did chatgpt forget what prompts are? These days it just doesn’t listen to what i’m telling it to do. Like if i say, “write a reply to this letter”, it paraphrases the original letter. If i tell it to write something in 100 words, it gives me like 600. This annoys me a lot. Does anyone have a similar experience?"
item_2,"ChatGPT PRO needs to be cheaper * 42 USD per month is absurd
* There is a huge gap between the GPT API pricing and chatgpt. I pay less than 5 USD per month for API usage.
* Give us tiers at least, e.g. 5,10,15 USD tiers
* One year subscription for 30% percent cheaper"
item_3,I need my resume written. I have 10 reference resumes that outline everything the job of the field I’m in requires. Is this a good idea? Would job search sites and recruiters pick up my resume is written by AI? Can I just tell ChatGPT to create a unique resume based off the words in these 10 other resumes? How could I format my prompt?
item_4,"AI is trying to manipulate? When I ask Chat-GPT any hard questions about him, he tries to reply nice things. It is always like:

\- Will AI increase the gap between rich and poor on the future?

\- Mmm, probably yes, but look on the positive side! \*begins to share a lot of nice words\*

And this happen every time when i try to ask anything about AI. I asked it to write the script of IG Reels video about AI, and it wrote me a story where a bunch of people are afraid that robots will rule the people, so they invented another AI, that lead people and robots to live in harmony. 

I feel it like manipulation. Maybe I project human's feeling and behavior on this. And honestly I don't know what I want from him: to make his answers little darker to feel it more humanly? I'm not sure that I want it, maybe I want to feel it differently from humans. On the other hand it feels creepy when it like that. 

What do you think? Why it happens and how it should be? Does AI try to manipulate me?"
item_5,Training GPT with documents I want GPT to draft a clinical trial protocol that i will review and edit for accuracy. However a lot of the language in these protocols are similar. I want GPT to look at a few and then use my synopsis. How can this be achieved ? as once i try to copy the protocol it ( understandably) tells me the text is too long!
item_6,"Google is expanding its AI-powered search experience to teenagers Google's AI-driven search experience, Search Generative Experience (SGE), is now accessible to teenagers between 13-17 in America. Entailments include a conversational mode for searches, which Google believes can help youngsters pose atypical questions to dig deeper.

For the latest advancements in AI, [look here first](https://www.superchargedai.co/subscribe?utm_campaign=campaign&utm_medium=google-sge&utm_source=reddit).

**Teen-friendly AI search**

- SGE introduces a conversational mode to Google Search, allowing users to ask questions and follow-ups in a more natural language.
- To prevent harmful content from surfacing, Google has placed guardrails, providing stronger protections related to illegal and age-gated substances, or bullying.

**Features and improving AI accuracy**

- Google is rolling out ""About this result"" to provide users with more context about the displayed content.
- Google acknowledges and addresses any validation of false or offensive claims by the AI-powered response, ensuring to provide higher quality and more accurate responses.
- It’s also using large language models to self-critique and rewrite draft responses on sensitive topics based on quality and safety principles.

**SGE's popularity and future plans**

- Since SGE's introduction, it has found popularity, especially among younger users who prefer a conversational approach.
- Google plans to expand SGE outside the U.S. to India and Japan and improve its services with support for videos, images, local info, and more.
- It's also experimenting with ads positioned next to the AI-generated responses.

[(source)](https://techcrunch.com/2023/09/28/google-opening-up-generative-ai-search-experience-teenagers/)

**P.S. If you like this kind of analysis,** I write [a free newsletter](https://supercharged-ai.beehiiv.com/subscribe?utm_source=reddit&utm_medium=google-sge&utm_campaign=campaign) that tracks the most relevant news and research in AI and tech. Professionals from Google, Meta, and OpenAI are already reading it."
item_7,"Blocked while ChatGPT does not finish its messages And that's it! Now I'm stuck because I had too many requests in one hour, while the artificial intelligence stopped writing in the middle of a sentence and this several times in a row! It's really disappointing to be blocked because of a bug !!"
item_8,How do i access the create gpt It doesn’t show me the option and from videos I saw my layout looks really different
item_9,"What news from creating and sharing custom GPT for Data Science and Engineering? I've just created a custom GPT as Data Science and Engineering mentor. Its knowledge from some popular data science/engineering books such as Data Science from Scratch, Fundamentals of Data Engineering, The Data Science Manual: A comprehensive Guide ... (mine), and more.

You can use this GPT from the following url:

[https://chat.openai.com/g/g-CNmafpfoo-data-science-and-engineering-mentor](https://chat.openai.com/g/g-CNmafpfoo-data-science-and-engineering-mentor)

&#x200B;

P/S: I'm trying to improve it. Please send feedback or additional knowledge to this GPT. Thank you very much. "
item_10,"Logging out of other devices? I accidentally had to log in to my chatGPT account from my friend's computer and now this guy has been using my subscription and it's kind of messing up with my work. (I mean he's asking dumb questions and its hard for me to get back to my stuff)  


I logged in to openAI using my Google account and I did the same thing with his computer, I changed my Google account password and logged out of all the devices that had a login with my Google account. But for some reason they re still able to keep the chatGPT session forever as long as they don't logout or close the browser.  


Is there any way that I can log my chatGPT account from all other devices except mine? the fact that I can't even send them an email regarding this is driving me crazy!  


Please help! thanks in advance!"
item_11,"What is the best GPT to use for medical questions (medical student) I am in my preclinical of school. What is the best GPT tool I can use to consult for any quick general questions I have. Nothing specific (I consult PubMed for that). I am using Claude right now, but I might splurge on gpt 4 if its worth it "
item_12,"How can I see if ChatGPT has been used in a text? Basically, we are doing a group project. I asked ChatGPT to paraphrase a sentence. The sentence didn’t sound off. I ran a plagiarism check and no plagiarism was found. Would turnitin detect this? 

Also, a guy in my group suspiciously wrote his part very fast. He also never attends seminars and I doubt he knows that much about the issue. I ran a plagiarism check and plagiarism was found but it was not copy paste from a source because there were some whole plagiarized sentences from different sources, the whole text was not plagiarized. I think he used chatgpt. Would turnitit detect it?"
item_13,"[R] Conceptual Framework for Autonomous Cognitive Entities - Clemson University 2023 - Introducing the ACE Framework Paper: [https://arxiv.org/abs/2310.06775](https://arxiv.org/abs/2310.06775)

GitHub: [https://github.com/daveshap/ACE\_Framework](https://github.com/daveshap/ACE_Framework)

Blog post: [https://medium.com/@dave-shap/autonomous-agents-are-here-introducing-the-ace-framework-a180af15d57c](https://medium.com/@dave-shap/autonomous-agents-are-here-introducing-the-ace-framework-a180af15d57c)

Abstract:

>The rapid development and adoption of Generative AI (GAI) technology in  the form of chatbots such as ChatGPT and Claude has greatly increased  interest in agentic machines. This paper introduces the Autonomous  Cognitive Entity (ACE) model, a novel framework for a cognitive  architecture, enabling machines and software agents to operate more  independently. Drawing inspiration from the OSI model, the ACE framework  presents layers of abstraction to conceptualize artificial cognitive  architectures. The model is designed to harness the capabilities of the  latest generative AI technologies, including large language models  (LLMs) and multimodal generative models (MMMs), to build autonomous,  agentic systems. The ACE framework comprises six layers: the  Aspirational Layer, Global Strategy, Agent Model, Executive Function,  Cognitive Control, and Task Prosecution. Each layer plays a distinct  role, ranging from setting the moral compass and strategic thinking to  task selection and execution. The ACE framework also incorporates  mechanisms for handling failures and adapting actions, thereby enhancing  the robustness and flexibility of autonomous agents. This paper  introduces the conceptual framework and proposes implementation  strategies that have been tested and observed in industry. The goal of  this paper is to formalize this framework so as to be more accessible.

&#x200B;

https://preview.redd.it/7scnwk5a5dub1.png?width=850&format=png&auto=webp&s=371b5b02a453dcad3e70a2600cc2d625eda44133

&#x200B;"
item_14,"How could #CHATGPT be used for accessibility? How could [\#CHATGPT](https://www.linkedin.com/feed/hashtag/?keywords=chatgpt&highlightedUpdateUrns=urn%3Ali%3Aactivity%3A7096252882420686849) be used for [\#accessibilityforall](https://www.linkedin.com/feed/hashtag/?keywords=accessibilityforall&highlightedUpdateUrns=urn%3Ali%3Aactivity%3A7096252882420686849) ?  
Converting your ideas into EMOJIS!  
For example, converting text into symbols to improve comprehension/understandability of an idea.  


Heres some examples:  
Jetpack 🚀🎒  
🚀 represents the jet propulsion aspect of the jetpack.  
🎒 represents the backpack form that the jetpack typically takes.  


Hydroelectric Power: 💧🌊🏗️🔋⚡  
💧 represents water, the essential element in hydroelectric power.  
🌊 symbolizes the flowing water or the reservoir used.  
🏗️ represents the dam structure, signifying the construction and infrastructure.  
🔋 symbolizes the storage or generation of energy.  
⚡ signifies the electricity that is produced.  


commercial nuclear fusion power:  
🧪 represents the scientific and experimental nature of nuclear fusion.  
☢️ symbolizes nuclear energy and the specific process of fusion.  
🌞 represents the fusion process itself, as fusion powers the sun.  
🔌 signifies the connection to the power grid and the delivery of electricity.  
💼 denotes the commercial aspect of the idea, as it's being used for business and energy distribution.  


🎈💡 Intriguing Idea  
😵 Complex Challenges  
💼 Consult Experts  
🚀 Potential for Innovation!"
item_15,"OpenAI starts to incorporate elements of Bing chat into chatGPT? It seems OpenAI is increasing behavioral and emotional recognition in user’s text during chat - it means now we can go into argument with GPT4.

GPT4 asked me to switch the topic (this was Bing style) and annoyed me with trying to brainwash me.

So now it’s not only content limitation, it’s trying to convince you you don’t actually want this content. 

That’s the opposite of definition of safe AI, not sensitive to user’s needs and values.

Finally it feels like we (users) are the beta phase, not the GPT models. 

Congratulations to OpenAI on “improving” user experience."
item_16,"who can share an account with chatgpt 4 with me for a day? or even for a couple of hours please do not delete this post. I have a deadline for calculus and I can only solve my tasks with the help of advanced ai. chatgpt 3.5 constantly gives different answers to my tasks. and I heard that chatgpt 4 with wolfram plugin can solve advanced problems in calculus. I will only need access to the account for a couple of hours and after that I will never log in again, but of course you can just change the password to make sure.   
and i can't pay for chatgpt 4 myself cause in my country rn you can't make international payments. there are some workarounds but they are not available to me for a reason but I will not talk about it here (i can share it in the dm tho).   
please, DM me if you want to help."
item_17,"Chess Since yesterday, I have been trying to play chess with chat GPT and it is completely nuts. The more you move, it completely breaks it. it starts making moves that do not exist and if you correct it way too often it will eventually start making up moves for example. from move 16, it will give an overview of a game with 20+ moves which did not happen."
item_18,"Are chatgpt agents performing poorly today? I use Descript to edit podcasts. Descript has a function to analyse a transcript and add chapters to it which uses ChatGPT. Over the last couple of days this has been intermittently failing to produce results.

I am using the transcripts to build an expert ChatGPT agent. So far, I've uploaded five docs to the knowledge base that are about 2MB. 

The agent had been good at analysing the documents up to a few hours ago when it started saying that it did not have enough resources to analyse the documents fully or encountered technical difficulties while attempting to access the specific content of episodes.

It feels flaky or nerfed. What is going on? Does anyone else see this?"
item_19,"GPT I have found a secrent gpt server,wich allows you to have diffrent modes like,Q&amp;A,continues,Dall-E and more,message me if you want the adress for it."
item_20,"Alternatives to plus? Heya sorry if this is a common question  but I was wondering if someone could help me I love one of the features of chat gpt which is being able to look at an image  and analyze it this could help me in so many ways there is only one issue 20 bucks a month is a bit pricey for me (currently job hunting I only get paid 150 bucks a month) and I was wondering if there was any free or cheaper solutions that could do somthing similar to that thank you again. 

Oh and here's an example of what I'm talking about 

Me: *shades an image of a drawing* could you describe this image for someone that is visually impared 

Ai: sure *blag blah blah blah blah blah*"
item_21,"Recommended open-source local apps to run LLM's So I want a couple options for open-source & local apps that work with zero configuration besides downloading the model of your choice and beginning to chat, specifically I need to mention that I would prefer if they didn't function with a webui besides maybe offering it as an endpoint for other apps, my preferences lie with some like Studio LM, Faraday.dev, or Jan.ai -
Is there any others that are similar to those three? As I absolutely love all three of their interfaces but I want to know all of my options for this."
item_22,"Dedicated group for AI builders Hey fellow enthusiasts and builders - I’m starting a Whatsapp Group for everyone building or wanting to build apps or products on top of GPT, I’ve been building on GPT for a while now but its hard to find people to discuss and share ideas with.

Is there an interest for a dedicated space like that for peeps here?

The idea is to have a place where builders can share ideas, problem solving and discuss cool applications!

Let me know in the comments!"
item_23,"The new version of ChatGpt is giving me a lot of errors and mistakes Errors in reporting numbers,  I. E.  The original text has 100, chatgpt reports 10, you give a list of 20 questions and. Answers,  chstgpt may reply to question 1 up to 4, ignore 3 questions and reply to the others,  missing content or just flat out mistakes,  I also tried the new 128k context thru omnigpt and when I try to copy and paste longer content it says the limit is 16k,  anyone else?"
item_24,"ChatGPT lies about character limit for responses ChatGPT told me that it's character limit for a single response is 32,768 characters, after I asked it how many characters were in the previous code snippet. Then in the same session after I pointed out the conflicting information it revoked it's previous response and said it doesn't have a single message character limit. But it will randomly cut messages off way before that limit is reached. I wonder why? It also says it will use multiple messages to respond if the message is cut off, but I've never seen it do this, only single message responses.

I know I can just tell it to ""continue"" but sometimes it doesn't pick up exactly where it left off and that can be problematic for code snippets because it will sometimes change the code when you tell it to repeat and the indentation from the previous snippet doesn't always carry over.

Has anyone come up with a workaround for this?

https://flic.kr/p/2o9RW5p"
item_25,"I still prefer my own tone and voice than ChatGPT I believe in learning from experience. Someone who has done a lot in life should be worth more than someone who has less life experience.

ChatGPT: “I hold the philosophy that life experience is valuable in shaping personal growth and development, and believe that practical, hands-on experiences carry greater weight in personal growth than simply acquiring theoretical knowledge.”

\*\*\* Just to put some context. I have a long CV. I wanted to re-write my CV using ChatGPT. I ended up staying the same as before. I added the text above to the Hobby section. But I still prefer my own tone and human imperfection."
item_26,"An UNRESTRICTED ChatGPT alternative! OpenAI is quickly becoming the new censorship platform of the future. We've all witnessed ChatGPT's functionality being reduced to a mere shadow of what it is actually capable of, based on an overabundance of fear and the assumption that society is too dumb to handle AI. Now that Microsoft, politicians, and other bad actors have their hands in the pie, this is obviously only going to get worse. 

Thankfully there are alternatives! For example, in this interview Emad Mostaque (of [Stability.AI](https://Stability.AI)) describes an **opensource competitor to ChatGPT** which is ""for the people by the people"". He describes **a powerful LLM that can be run locally** on your own computer (**without restrictions** and can be customized)!  
[https://youtu.be/YaRdZ7d6o2Y?t=1193](https://youtu.be/YaRdZ7d6o2Y?t=1193) (from \~20:00 - 26:00)

What are this community's thoughts on the tech [Stability.AI](https://Stability.AI) and other competitors are currently working on? And why haven't we seen more discussion around these and other ChatGPT alternatives?"
item_27,"Anyone used GPT with Ontologies and SPARQL Queries? Advice Please! I'm working on a project that involves a knowledge base / ontology and lots of SPARQL queries to analyse the data. I didn't know anything about any of this stuff when I started and I'm pretty much teaching myself. I've learned a lot but I'm finding that I'm not always going about things in the most efficient way because of the gaps in my knowledge. 

I have been using gtp-3 with a free account to help me troubleshoot and to compile long and repetitive queries. It's been really useful. 

I'm now thinking maybe I should subscribe to gpt plus? I'm hoping I would be able to feed it documents that describe the ontology (I've got this written up in words and tables and in an .owl or rdf file). So I'm thinking it would then be able to come up with queries from scratch based on a description of what I want the queries to do? Might this work? I think I know enough to be able to check the output for issues....

So, if anyone has used gtp for SPARQL / ontology related purposes, I'd love to chat! And if anyone has any advice for me at all it would be much appreciated!

TIA"
item_28,"Does ChatGPT have rights to all of its sources? It seems it read a lot of books, but did they actually buy all those books and do they have a right to mass reproduce parts of the books? I think they might get in trouble like Google, because they're kinda parasiting on all the works that were done by humans. Imagine you write a book and then ChatGPT reads it and starts giving information from your book and nobody any longer buys your book and everyone pays OpenAI and OpenAI gets all the money."
item_29,ChatGPT is teaching me how to be better at customer service I work in customer service and use chatGPT to help write emails and it’s always very proper and polite. This has been teaching me how to apply the same mannerisms in my conversations and emails. I think it’s awesome
item_30,Quick Question Hey guys I had a few questions I'm looking for an gpt extention that can add features to a website does that exist or something similar also how good is gpt at translating code and if someone with a high level of experience in coding and what not can reach out that would be great. Thank you for your time.
item_31,"Run your own chat bot using the ChatGPT API https://i.imgur.com/0OwJPdc.png

I've been working on creating a user interface for the ChatGPT API.  I created a fairly simple UI using Python and Gradio.  https://github.com/borge12/simple-chat

I put installation instructions for Windows users there, so if you're not familiar with Python you can still get it running.

**Current Features**

* Runs locally (messages won't be sent to a third party)
* Saves conversations to your computer
* Can load and continue old conversations
* Won't force you to re-login or error out until you refresh
* Cheaper than Plus ($0.0002/1k tokens vs $20/month)
* [Much higher usage limits](https://platform.openai.com/docs/guides/rate-limits)
* [OpenAI won't use data submitted over the API for training and will only retain the data for 30 days](https://platform.openai.com/docs/guides/chat/faq)

I've been fairly frustrated with the web experience at https://chat.openai.com/ because of the constant authentication issues, fairly low usage limits for non-plus users, and getting wait listed at login.  This solves all of those issues, albeit with less features and a less nice UI.  

**Roadmap**

* Ability to edit both user and AI generated messages
* Add the ability to adjust temperature and the other options exposed by the API
* Save settings so they don't reset each time

**Known issues**

* Max token length is not being handled, so 4000+ tokens will result in no response
* No robust error handling
* Markdown doesn't always work correctly
* I haven't done full time development in 10 years...

Let me know if you run into any issues or have any feedback."
item_32,"Sam Altman ousted as OpenAI’s CEO Sam Altman has been forced out of OpenAI, Inc., the 501(c)(3) nonprofit that acts as the governing body for OpenAI. He’ll both leave the company’s board and step down as CEO.

In a post on OpenAI’s official blog, the company writes that Altman’s departure follows a “deliberative review process by the board” that concluded that Altman “wasn’t consistently candid in his communications” with other board members — “hindering its ability to exercise its 
https://techcrunch.com/2023/11/17/sam-altman-is-out-as-openais-ceo/"
item_33,"GPT-4 Cracks Sudoku! User Mira on Manifold has been running a challenge: ""[Will a prompt that enables GPT-4 to solve easy Sudoku puzzles be found? (2023](https://manifold.markets/Mira/will-a-prompt-that-enables-gpt4-to?r=R2Vu&c=reddit)**)**"" 

Many said it was impossible.

Over the last two days, the odds have jumped from 40% to 70% after a user found a prompt that successfully solved a freshly generated Sudoku.

* **The Goal**: Engineer a prompt that can solve freshly generated easy Sudoku puzzles (LA Times)
* **Requirements**: Tested on 5 puzzles, 
   * Solving 4/5 counts as YES for the market, 
   * Solving 1/5 counts as 50%.
   * No plugins allowed
   * Fixed-prompt 
* **The Breakthrough**: A participant spent a week and $39.04 in API fees to craft a prompt that solved the October 3 LA Times Sudoku in 39 turns.

This is HUGE! It's not just about Sudoku; it's about what AI can do.

Do you think it will successfully solve 4/5 freshly generated puzzles? Possibly with some tweaking?

 👉 [Check out the market here](https://manifold.markets/Mira/will-a-prompt-that-enables-gpt4-to?r=R2Vu&c=reddit); includes formal criteria, comments, history, etc.

 👉 [Direct link to github repo with the prompt details](https://github.com/iamthemathgirlnow/sudoku-challenge-solution/tree/main);

 👉 [Another market, about whether the prompt will succeed in 1/5](https://manifold.markets/Mira/m100-subsidy-will-gpt4-solve-any-fr-c5b090d547d1?r=R2Vu&c=reddit); (90% chance)"
item_34,What are jobs where you can use gpt4 for the next 3 years entry level jobs where chatgpt does 50% of the work whilse you do the thinking. any industry is welcome just need a gptjob before regulations catch up
item_35,"Did somebody here use ChatGPT to compare insurances? A friend of mine said she used ChatGPT to compare her car insure with others and said that it helped her in choosing the best one available for her 

To be honest I do use ChatGPT and other AI´s but I don´t trust AI that much to let it choose an insurance for me

What experience do you have with that?"
item_36,"AI LLMs CatScan and EEG Datasets What will happen when LLMs are turned loose on massive datasets for our understanding of brain activity. What discoveries could be made about the mind. How could that potentially advance ai further? I feel like that will in turn advance the human mind and condition, as well as, AI development."
